{"$schemaId":"https://schemas.cp6.dev/release/candidate-result.v2","evidencePolicyVersion":1,"releaseGateResult":{"byteLength":1,"key":"objects/sha256/aa/aaaaaaaaaaaaaaaaaaaaaaaaaaaaaaaaaaaaaaaaaaaaaaaaaaaaaaaaaaaaaaaa/release-gate-result.v1.json","mediaType":"application/vnd.cp6.release-gate-result.v1+json","sha256":"aaaaaaaaaaaaaaaaaaaaaaaaaaaaaaaaaaaaaaaaaaaaaaaaaaaaaaaaaaaaaaaa","storageAuthority":"cp6-release-r2-v1"},"releaseTag":"v0.10.0-test.1","repositories":["CP6","CP6.CRM","CP6.Platform","CP6.Portal"],"systemManifest":{"byteLength":1,"key":"objects/sha256/aa/aaaaaaaaaaaaaaaaaaaaaaaaaaaaaaaaaaaaaaaaaaaaaaaaaaaaaaaaaaaaaaaa/system-release-manifest.v1.json","mediaType":"application/vnd.cp6.system-release-manifest.v1+json","sha256":"aaaaaaaaaaaaaaaaaaaaaaaaaaaaaaaaaaaaaaaaaaaaaaaaaaaaaaaaaaaaaaaa","storageAuthority":"cp6-release-r2-v1"},"trustPolicyVersion":1,"validationWorkflow":{"commitSha":"bbbbbbbbbbbbbbbbbbbbbbbbbbbbbbbbbbbbbbbb","conclusion":"Success","environment":"test","repository":"GTX537/CP6","runAttempt":1,"runId":1,"workflowFileSha":"bbbbbbbbbbbbbbbbbbbbbbbbbbbbbbbbbbbbbbbb","workflowPath":".github/workflows/release-validation.yml"}}